"id","glk_word","glk_example","en_word","en_example"
1,"آ","آ مأمۊد خؤرم آدمه","Mr.","Mr. Mahmoud is a good person"
2,"آب دأن درم","گۊلانأ آب دأن درم","Watering","I'm watering the flowers"
3,"آج","آج بأورده","Insatiable","He/She is insatiable"
4,"آجۊر","آجۊر ديفارˇ جأ کفتن دره","Bricks","The brick is falling from the wall"
5,"آخربسر","من کي دأنم آخربسر وا بأئي مي ويجأ","Finally","I know that you finally must come to me"
6,"آخرپس","شانامه آخرپس خۊشه","End","The end of Shahnameh is happy"
7,"آدم-نفر","شيمي آدم -نفران کؤيأ ايسأئيد؟","Members","Where are your members?"
8,"آشخال جابه","آشخالانأ تأود آشخال جابه","Trash Bin","Throw garbage in the trash bin"
9,"آغۊز","آغۊز خۊري؟","Walnut","Do you eat walnut?"
10,"آلاخان والاخان","آلاخان والاخاني جأ بئتره","Homeless","It is better than being homeless"
11,"آها","آها، منم أيم","Yes","Yes, I come too"
12,"آهين","مي دۊکان آهين پۊرد ٚ ور نهأ","Iron","My shop is next to the iron bridge"
13,"آوج","هرچي زنگ بزئم آوجأ ندأ","Answer","Whatever I called he/she didn't answer"
14,"أ","شۊفاژأ چأکۊدي؟","The","Did you repair the radiator?"
15,"أبچ","أبچˇ کاران کۊدن نوأ","Corny","Don't do something corny"
16,"أتؤ","أتؤ ني-يه","Like This","It's not like this"
17,"أجۊر","أجۊر چي-يان مرأ حالي ني-يه","Such","I don't understand such things"
18,"أذب","مي برار أذبه","Single","My brother is single"
19,"أرايم","أرايم بيأ","This Way Too","Come this way too"
20,"أرسۊ","تي أرسۊئانأ پاکۊن","Tear","Wipe your tears"
21,"أزازيل","أ أزازيلˇ زاکانأ فأندر","Very Naughty","Look at these very Naughty kids"
22,"أسباب","ايپچه أسباب بأورم بۊخۊري؟","Snack","Should I get you some snack to eat?"
23,"أشان","أشان کي أمؤن دريد کيسيد؟","They","Who are they coming?"
24,"أشبل","مائي أشبلˇ مرأ کۊکۊ چأکۊنيدي","Fish Egg","They make cutlet with fish egg"
25,"ألاو","جه وس هوا سرده أمي دهنأ ألاو بيرۊن أيه","Steam","It's too cold that steam come from our mouth"
26,"ألباقي","شيرˇ ألباقي-يأ دۊکۊن جا دۊرۊن","Remaining","Pour the remaining milk into the dish"
27,"ألنگ","مرأ ألنگ بزه بکفتم","Trip","He/She tripped me and I fell"
28,"أمأن","أمأن دۊ نفريم","We","We are two people"
29,"أمؤن","ورزشگا جأ أمؤن درم","Coming","I'm coming from the stadium"
30,"أمبست","أ دؤغ پۊر أمبسته","Thick","This yogurt is very thick"
31,"أمرأ","منم تي أمرأ أيم","With","I'm coming with you"
32,"أمي","شۊمانم أمي أمرأ أئيدي؟","Us","Are you also come with us?"
33,"أن","أن چيسه؟","This","What is this?"
34,"أنديفه","أ ساعت چارصد تۊمۊن أنديفه دأره؟","Worth","Is this watch worth four handred Tomans?"
35,"أنگاره","چي ره أنقد أنگاره بيده-ئي؟","Prepare","Why did you prepare this much?"
36,"أوانگاره","هأچين أمه ره أوانگاره بيده-ئيم","Trouble","We made trouble for ourselves because of nothing"
37,"أوري","مي کافشينأ أوري؟","Would You Bring","Would you bring me my jacket?"
38,"أولي","تي أولي زاکه؟","First","Is this your first child?"
39,"أوير","مي ساعتأ أويرأ کۊدم","Lost","I lost my watch"
40,"أويستي","أشان دۊتا أويستي-يأ مأنيدي","Rival Wives","These two look like someone's rival wives"
41,"أيأ","تي کيليدانأ أيأ بنأ بۊم","Here","You left your keys here"
42,"أياز","أياز بينيشته گۊلانˇ سر","Dew","There's dew on the flowers"
43,"أژدم","تي پلا أژدمه","Very Salty","Your rice is very salty"
44,"أکه","أکه تأنيم بازي بۊکۊنيم؟","When","When can we play?"
45,"ؤ","من ؤ حۊسئن دۊتائي شيم","And","Me and Hosein will go together"
46,"ارجئن ارجئن","﻿کاغذانأ همهˈ ارجئن ارجئنأ کۊده","Shred","He/She shred all the papers"
47,"اي","اي ميليۊن تۊمۊن پۊل خأیم","One","I need one million Tomans cash"
48,"اي فچم","ترأ بيدينم اي فچم ماچي دهم","A Lot","If I see you I'll give you a lot of kisses"
49,"اي مۊشته","اي مۊشته بج مرأ فأدن","A Fistful","Give me a fistful of rice"
50,"اي وخت","اي وخت پۊر ترأ خأستيم","Once","I once wanted you so much"
51,"اي ور","أنˇ رختان هرتأ اي ور کفته","One Corner","Each one of his/her clothes lies in one corner"
52,"اي وري","أ تابلؤ چي ره اي وري نهأ؟","Crooked","Why is this board crooked?"
53,"اي پئم","اي پئم سيبيشکا مرأ فأدي؟","A Fistful","Will you give me a fistful of sunflower seeds?"
54,"ايتأ","ايتأ کاغذ مرأ فأدن","A","Give me a paper"
55,"ايجانا","من ؤ ميعاد ايجانا بۊشؤئيم بيرۊن","Together","Miad and I went out together"
56,"ايدانه","ايدانه کۊئي خأيم","One","I want one pumpkin"
57,"ايدفأ","ايدفأ بامؤم شيمي خانه","Once","I once came to your home"
58,"ايدفأئي","ناصر ايدفأئي بامؤ اۊتاقˇ دۊرۊن","Suddenly","Nasser suddenly entered the room"
59,"ايدقه","ايدقه بئس","A Minute","Wait a minute"
60,"ايرۊز","ايرۊز دئه بمانسته مي تعطيلي-يان تۊمانأ به","One Day","One day remains until my holidays end"
61,"ايزه","ايزه بۊشۊ اۊشنتر","A Little Bit","Move over a little bit"
62,"ايسأبيد","ديشب همه أمي خانه ايسابيد","They Were","They were all in our house last night"
63,"ايسال","ايسال دئه مي درز تۊمانأ به","One Year","My education will end in one year"
64,"ايسم","تي ايسم چيسه؟","Name","What's your name?"
65,"ايسيد؟","شۊمان چن نفر ايسيد؟","Are You?","How many people are you?"
66,"ايسکمۊ","بۊشۊ دۊکان دۊتا ايسکمۊ بيهين","Ice Pop","Go to the shop and buy two ice pops"
67,"ايشتاو","هأی أمرأ ايشتاو ديهه","Warning","He/She constantly warning us"
68,"ايشتاوي","ايشتاوي چي گمه؟","Do You Hear","Do you hear what I'm saying?"
69,"ايششه","ايششه، لانتي","Ew","Ew, snake"
70,"ايشماردن","مي زأى ايشماردنأ نأنه","Count","My kid doesn't know how to count"
71,"ايشکؤر","کيشکائان ٚ رئم ايشکؤر فۊکۊن","Rice Crumbs","Sprinkle rice crumbs for chickens too"
72,"ايشکنئن","چي-يأ ايشکنئن دري؟","Break","What are you breaking?"
73,"ايمرۊ","ايمرۊ بۊشؤم کيتابخانه","Today","Today I went to the library"
74,"اينسان","اينسان بۊبۊ","Human","Be human"
75,"اينفر","اينفر دئه خأئيم أمي جرگه چأکۊده ببه","One Person","We need one more person to make our group"
76,"ايوار ايوار","ايوار ايوار شئطان مرأ گه . . .","Occasionally","Occasionally, Satan tells me. . ."
77,"ايواردم","ايواردم وا بشم بازار","Once Again","I have to go to the market once again"
78,"ايوارٚکي","ايوارٚکي بۊگۊ نأيم ترأ راحتأ کۊن","Suddenly","Suddenly say I'm not comming and get rif of yourself"
79,"ايپيچم","گۊش نۊکۊني ايپيچم ترأيأ","I'll be aggressive","I'll be aggressive if you don't pay attention"
80,"ايپچه","ايپچه پلا مه ره دۊکۊن","A little bit","Serve me a little bit of rice"
81,"ايچي","ايچي خأيم ترأ بگم","Something","I want to tell you something"
82,"اۊتاق","مي اۊتاق کؤيتأ ايسه؟","Room","Which one is my room?"
83,"اۊدۊشتن","سۊمبۊرˇ مأنستن أمي خۊنأ اۊدۊشتن دريد","Suck","They're sucking our blood like a leech"
84,"اۊرشين","کترأيأ اۊسادم قاتؤقا اۊرشين بزئم","Stir","I picked up wooden spoon and stir the stew"
85,"اۊسان","قاقؤشاقانأ اۊسان بأور","Pick Up","Pick up the spoons and bring them"
86,"اۊسه کۊد","أ کيتابأ کي اۊسه کۊد؟","Sent","Who sent this book?"
87,"اۊشان","اۊشان کيسيد؟","They","Who are they?"
88,"اۊشکؤفت","آب مرأ اۊشکؤفت","Choked","I choked on water"
89,"اۊن","اۊن چيسه؟","That","What is that?"
90,"اۊيأ","مهينˇ کيف اۊيأ نهأ","Over There","Mahin's Bag is over there"
91,"اۊچين","تي کيتابانأ اۊچين","Collect","Collect your book"
92,"اۊکۊف","أمه ره اۊکۊف دره","Presage","It has presage for us"
93,"بأور","بۊشۊ مي کيفأ بأور","Bring It","Go Bring my bag"
94,"بؤبؤسته","أ پلا دئه بؤبؤسته","Ready","The rice is ready"
95,"بؤبؤسته","چي بؤبؤسته؟","Hppened","What has been happened?"
96,"بؤبؤسته","مهسا مردˇ ره بؤبؤسته","Married (With a Man)","Mahsa married"
97,"بؤرسفته","مي کيفˇ بند بؤرسفته","Torn","My bag's handle is torn"
98,"بؤرسن","دئه بؤرسن","Stop","Stop it"
99,"بؤق","ماشينˇ شيشه بؤق بۊکۊده","Steam","Car's glass has been steamed"
100,"بئس","ايمشبأ أمي خانه بئس","Stay","Stay in our house tonight"
101,"بئس","ايپچه بئس","Wait","Wait a little bit"
102,"بئگان","هۊيأ بئگان","Throw","Throw it there"
103,"بار بامؤئيد","گيلکان نترس بار بامؤئيد","Are Trained","Gileks are trained to be brave"
104,"باش","خۊ پيله برارأ باشه","Dominant","He/She is dominant over his/her older brother"
105,"باقي بمأنسته","أنˇ باقي بمانستهٰ چي بۊکۊنم؟","Remaining","What shuld I do with the remaining?"
106,"بال","مي بالأ بيگير","Hand","Take my hand"
107,"بال زئن","أنˇ پئر أنأ بال بزه","Support","His/her father supported him/her"
108,"بالاخا","أمي بالاخا ويريشته","Stood Up","He/She stood up for us"
109,"بامؤخته","بامؤخته آدمأ همه دۊس دأريدي","Polite","Everyone loves a polite person"
110,"بامؤختي","اۊشاني کي بۊگؤفتمه بامؤختي؟","Did You Learn","Did you learn what I said?"
111,"ببه","أگه أتؤ ببه","Be","If it be like this"
112,"ببه","من گب خبربري نۊکۊنم هرچي خأيه ببه بدأ ببه","Be","I don't gossip whatever it is let it be"
113,"بتپسته","يخچال أسبابˇ جأ بتپسته-يه","Full","The fridge is full of things"
114,"بج","ايمسال بج گيرانأ بؤسته","Rice","Rice has become expensive this year"
115,"بجار","أگه کاري نۊکۊنيم أمي بجاران همه دس جه شيدي","Rice Field","If we don't do anything all of our rice fields will be gone"
116,"بجارکار","بجارکار کۊدن دره","Farming (on Rice Field)","He/She is farming on the rice field"
117,"بجاوسته","کي خۊ بجاوسته آدامسأ تاودأ خيابانˇ دۊرۊن؟","Chewed","Who threw his/her chewed gum in the street?"
118,"بجسته","مي دسˇ رگ بجسته","Prominent","The veins on my hand got prominent"
119,"بخألي","بخألي آخري سال ببه","I Guess","I guess it's the last year"
120,"بدأ","بدأ بيدينم چي تأنم بۊکۊنم","Let Me","Let me see what can I do"
121,"بدگيل","أ مانتؤ بدگيل ني-يه أمما مي ديلأ نيگيفته","Ugly","This manteau is not ugly but not my favorite"
122,"برأر","مي برار بۊشؤ ايجباري","Brother","My brother has gone to military"
123,"برار زن","أفشينˇ برارزن مي ريفئقه","Sister in Law (Brother's Wife)","Afshin's sister in law is my friend"
124,"برارزا","مي برارزا بۊشؤ مٚدٚرسه","Nephew/Niece (Brother's Child)","My nephew has gone to school"
125,"بردن","تقي زن ببرده","Married (With Woman)","Taghi married"
126,"برسه","أ خۊرمالۊئان برسه","Ripe","These persimmons are ripe"
127,"بزن بزن","ديرۊ أمي کۊچه سر بزن بزن بۊ","Fight","There was a fight in our alley yesterday"
128,"بسته","بسته کۊني؟","Bet","Do you bet?"
129,"بسر تأودأ","مأمد مرأ بسر تأودأ بشم بانک","Reminded me","Mohammed reminded me to go to the bank"
130,"بسر دکفتم","بسر دکفتم ايمسال بشم دانشگا","I Decided","I decided to go to university this year"
131,"بسچي","بسچي کي أيم","Definitely","I'll definitely come"
132,"بشکفت","ورفˇ سينگيني جأ أ دار بشکفت","Broke","Because of heavy snow this tree broke"
133,"بل","أن ٚ بل بلˇ گۊشأ فأندر","Protruding","Look at his/her protruding ears"
134,"بمأنستم","دئه بمأنستم","I'm Exhausted","I'm exhausted"
135,"بمأنسته","أ نان بمانسته-يه","Stale","This bread is stale"
136,"بمرده","کؤرؤنا وأسي دأني چن نفر بمرده؟","Dead","Do you know how many people are dead because of Corona?"
137,"بنأ اۊسان","آدم وا خۊ بنأ اۊسانأ بدأنه","Lifestyle","One must know his/her own lifestyle"
138,"بندام","بندامˇ آدمˇ مرأ نوأسي نيشتن","Infamous","Should not communicate with the infamous person"
139,"بنماسته","خؤرأ أمرأ بنماسته","Showed","He/She showed himself/herself to us"
140,"بنه","تي ماشينأ هأيأ بنه","Leave","Leave your car right here"
141,"به","أ راديؤ چأکۊده به؟","Will Be","Will this radio be fixed?"
142,"به زرف","پئله-يأ به زرف بزه زيمين بشکنه","Very Hard","He/She throw the saucer very hard on the ground and broke it"
143,"به فسکأ دأ","أمرأ به فسکأ دأ","Exposed","He/She exposed us"
144,"بي","تۊ ناصرˇ أمرأ بي","You Whre","You where with Naser"
145,"بي","مي أمرأ ريفئقأ بي؟","Will You","Will you be my friend?"
146,"بي شناق","بعضي-يان پۊر بي شناقيد","Ungrateful","Some people are very ungrateful"
147,"بي پا","گيلانˇ بجاران همه بي پا بؤستن دره","Destroyed","All of Gilan's rice fields are being destroyed"
148,"بي پۊشت","خۊدا بۊکۊنه هي کس بي پۊشت نبه","Alone","May no one be alone"
149,"بي چنگ ؤ مۊشت","آدم نوأ بي چنگ ؤ مۊشت ببه","Incapable","One must not be incapable"
150,"بياره","هرکي وا بياره خۊ گبأ بزنه","Dare","Everyone should dare to tell his/her words"
151,"بيافتي","وأمج ولکي بيافتي","You Found It","Search it maybe you found it"
152,"بيبيشته","بيبيشته بج خأيم","Fried","I want fried rice"
153,"بيجير","بيأ بيجير","Down","Come down"
154,"بيرۊن","بۊشۊ بيرۊن","Out","Get out"
155,"بيسپاردم","مرجانأ بيسپاردم","I Assigned","I assigned Marjan"
156,"بينا کۊده","سعيد ديرۊ تا هسأ بينا کۊده درز خأندن","Started","Saeed started to study from yesterday until now"
157,"بينيش","أيأ بينيش","Sit Down","Sit down Here"
158,"بينيويشته-کس","أ کيتابˇ بينيويشته-کس کيسه؟","Writer","Who is the writer of this book?"
159,"بيچه-ئي","اۊ کۊنۊسأ بيچه-ئي؟","Pick","Did you pick that common medlar?"
160,"بيگيفت","مي پۊلأ بيگيفت","Took","He/She took my money"
161,"بٚسٚر","چار ما بسر وا بشم پاریس","In Between","Four months in between I have to go to Paris"
162,"بچمسته","أنقد بجارکار بۊکۊدد أشانˇ کمر بچمسته دأره","Bent","They worked too much in the rice fields that their backs got bent"
163,"بچنگأ دأ","خۊ پۊلانأ همهˈ بچنگأ دأ","He/She Lost","He/She lost all his/her money"
164,"بچکسته","کارن بچکسته فني کارانˇ ره","Worthy","Karen is worthy for technical work"
165,"بچۊک","وحيدأ بيدئم بچۊک نيشته بۊ","Squat","I saw Vahid was sitting in squat"
166,"بکأشته","أ گۊلانأ حسن بکأشته","He/She Planted","Hasan planted these flowers"
167,"بکشه-ئي","چي بکشه-ئي؟","You Drew","What did you draw?"
168,"بکشه-ئي","أشانأ بکشه-ئي","You Weighed","You weighed these"
169,"بکفت","زأی دار ٚ جه بکفت","He/She Fell","The kid fell from the tree"
170,"بکفته راشي","أرأ شؤن نوأ بکفته راشي-يه","Abandoned Road","Don't go this way it is an abandoned road"
171,"بگردستيد","أول أمرأ بگردستيد","They Inspected","They inspected us first"
172,"بگشت","نأنم چي مرأ بگشت","Bit","I don't know what bit me?"
173,"بگنسته","آغۊز بگنسته مي سرأ","Hit","Walnut hit my head"
174,"بگيلأ کۊن","أ گبانأ هأيأ بگيلأ کۊن","Bury","Bury these words right here"
175,"بۊ","تي کار بۊ؟","Was/Were","Was it your job?"
176,"بۊجؤر","بۊشۊ بۊجؤر","‌Up","Go up"
177,"بۊجؤر اۊتاق","زاکانأ ببر بۊجؤر اۊتاق","The Room Upstairs","Take the kids to the room the upstairs"
178,"بۊخۊس","دئره، بۊشۊ بۊخۊس","Sleep","It's late, go to sleep"
179,"بۊدۊج","تأني مي پرهنأ بۊدۊجي؟","Sew","Can you sew my shirt?"
180,"بۊدۊرۊن","بۊشۊ بۊدۊرۊن","Inside","Go inside"
181,"بۊرۊز","تي فسکأ بۊرۊز دأن نوأ","Reveal","Don't reveal your secret"
182,"بۊز","مي پا بۊز مرأ در کۊنه","Heel","The heel of my foot hurts"
183,"بۊسۊجانه","غذايأ همهˈ بۊسۊجانه","Burned","He/She burned all the food"
184,"بۊشؤستم","تي رختانأ بۊشؤستم","I Washed","I washed your clothes"
185,"بۊفۊرؤختم","مي گۊشي-يأ تازگي-يان بۊفرؤختم","I Sold","I sold my phone recently"
186,"بۊچۊلکسته","أمي باغچه گۊلان بۊچۊلکسته","Withered","Our garden's flowers have withered"
187,"بۊک بۊکۊده","ايمرۊ چي ره بۊک بۊکۊده-ئي؟","Despondent","Why are you despondent today?"
188,"بۊکۊشيد","أشان خأئيد همهٰ بۊکۊشيد","Kill","They want to kill everybody"
189,"بۊگرؤختيم","صابخانه کي بامؤ أمان بۊگرؤختيم","We Ran Away","When the house owner came we ran away"
190,"بۊگۊ بيشتاو","شيمي بۊگۊ بيشتاوأ نيشتاوستم","Conversation","I didn't hear your conversation"
191,"بۊگۊ مۊگۊ","مي دۊماغ خارش کۊنه بۊگۊ مۊگۊيه","Gossiping","My nose itches someone gossiping about me"
192,"تأنم","تأنم أنأ چاکۊنم","I Can","I can fix it"
193,"تا به تا","تي جۊرافان چي وأسي تا به تايه؟","Mismatched","Why are your socks mismatched?"
194,"تا هسأ","تا هسأ کۊرم کلاچ بازي بۊکۊده-ئي؟","Ever","Have you ever played Kooram Kalacham?"
195,"تاخت","تاختأگير بخانه","Quickly","Go home quickly"
196,"تارانه","أنˇ کردˇکار همهˈ اۊنˇ جأ تارانه","Keeps Away","His/Her behavior keeps everyone away from him/her"
197,"تازه","تازه-چي بۊگۊ","New","Say something new"
198,"تازگي-يان","تازگي-یان عليأ بيدئي؟","Recently","Have you seen Ali recently?"
199,"تاشتن","مي ريشأ تاشتن درم","Shaving","I'm shaving my beard"
200,"تالان تالاني","أ تالان تالاني دۊرۊن نان گيرانأ بؤسته","Chaos","In this chaos bread became more expensive"
201,"تام","تام بزن","Quiet","Be quiet"
202,"تام","ايجۊر غذا خۊري آدمˇ تامأ دکفه","Crave","The way you eating makes me crave"
203,"تامتۊمازه","تامتۊمازه نيشته بۊ","Without Any Noise","He/She was sitting without any noise"
204,"تان","کاسپي دريا تان همه-جۊر مائي دره","Depth","In the depth of Caspian sea, there are all kind of fishes"
205,"تاوده","آشخالانأ تاوده اۊرأ","He/She Throws","He/She throws the garbages over there"
206,"تترج","هأتؤ تترج بنه","In a Row","Put it in a row"
207,"تجرۊبه","مي تجرۊبه گه أ کار آخرپس نأره","Experience","My experience says this doesn't work"
208,"ترˇ راکه","ترˇ راکه مرأ دکفته أمي دۊمبال","Thin Branch","He/She followed us with a thin branch"
209,"ترˇ چسب","ترˇ چسب بۊشۊ","Quickly","Go quickly"
210,"ترسانه","تي گبان أمرأ ترسانه","Scare","Your words scare us"
211,"ترکمه","أ زأى چقد ترکمه-يه؟","Disobedient","How is this kid so disobedient?"
212,"تس","أنقد بۊخۊرده تسأ بؤسته","Relaxing After Eating","He/She is relaxed after eating to much"
213,"تسکˇ ديل","بۊشؤم مي مأرˇ خبرأگير تسکˇ ديل بۊ","Missing","I went to visit my mother she was missing me"
214,"تشت","تشتأ اۊسان بأور","Copper Dish (High Sided)","Take that copper dish and bring it"
215,"تشتا","مرأ تشتايه","Thirsty","I'm thirsty"
216,"تفاق دکفته","منم نأنم چي تفاق دکفته دأره","Happened","I don't know what happened either"
217,"تفتک","أ تفتک دۊمرتبه بامؤ","Annoying Person","This annoying person came again"
218,"تنگام","داوۊدأ ترسأ گيره أ تنگامˇ کۊچهˈنأ دٚواره","Narrow And Dark","Davood scares to pass these narrow and dark alleys"
219,"ته ره","أ پرهنأ ته ره بيهين","For Yourself","Buy this shirt for yourself"
220,"تهب بسر","أمي أمبارأ جنس دره تهب بسر","Full","Our warehouse is full of items"
221,"تي","أن تي کاره؟","Your","It it your job?"
222,"تي","من تي مرأ أيم","You (Singular)","I'll come with you"
223,"تيان","بۊشۊ تيانأ بأور","Pot","Go bring the pot"
224,"تيتالي","زاکانˇ تيتالي ره کيتاب بخأنيد","Entertain","Read books to entertain kids"
225,"تيج","أ چاقۊ تيج ني-يه","Sharp","This knife is not sharp"
226,"تيري پيري","مي چۊمان تيري پيري شه","Dark","My eyes go dark"
227,"تيريج مائي","تيريج مائي کأسپي دریا مئن زيويسته","Starry Sturgeon Fish","Starry sturgeon fish lives in the Caspian sea"
228,"تينتير","هأی مه ره تينتير أمؤئي","Coquetting","He/she was constantly coquetting with me"
229,"تي‌تي","سئب دار تي‌تي بۊکۊده","Blossom","The apple tree has blossome"
230,"تٚلٚس","مي چۊم تلس بۊکۊد","Swollen","My eye is swollen"
231,"تٚمٚش","تٚمٚش مي دسأ جيجا کۊنه","Thorn","Thorn wounds my hand"
232,"تک","بزه مي تکأ","Rib","He/she hit my rib"
233,"تک دٚوٚد","حسن تک دٚوٚده","Bluff","Hassan is a bluff"
234,"تکام","هأچين تي سرأ تکام دأن نوأ","Shake","Don't shake your head for nothing"
235,"تۊر","پاک تۊرأ بؤسته دأره","Mad","He/She is gone totally mad"
236,"تۊرتۊره","پارچهˈ همهˈ تۊرتۊره ٰ کۊد","Tore Into Pieces","He/She tore all the clothes into pieces"
237,"تۊشک","خۊلي تۊشکأ فيشان","Seed","Throw away the greengage's seed"
238,"تۊشکه","أ تۊشکه وا نيبه","Knot","This knot doesn't untie"
239,"تۊقا","من گيلانˇ تۊقايم","Fond","I'm fond of Gilan"
240,"تۊمان","مي تۊمان کؤیا نهأ؟","Pants","Where are my pants?"
241,"تۊمان","فئلم تۊمانأ بؤسته؟","Over","Is the movie over?"
242,"تۊند","پۊر تۊند بۊ","Bad Tempered","He/She was very bad tempered"
243,"تۊند","تۊند بيأ","Quickly","Come quickly"
244,"تۊنداتۊند","تۊنداتۊند بۊشؤ","Hastily","He/She went hastily"
245,"تۊنگۊله","ايتأ تۊنگۊله بزن","Flick","Flick with your finger"
246,"تۊک","کيشکائانأ دۊمبالأ کۊني أشانˇ مأر ترأ تۊک گيره","Peck","When you following chickens their mother will peck you"
247,"تۊک","تي تۊک خۊن أمؤن دره","Lip","Your lip is bleeding"
248,"تۊکاپره","سجاد ؤ أکبر تۊکاپرهˈ ديبيد","Argue","Farzad and Ahmad were arguing"
249,"تۊکه","آب تۊکه کۊنه","Drip","Water is dripping"
250,"تۊکه","ايتأ تۊکه آب مرأ فأدن","Little Bit","Give me a little bit of water"
251,"جأ","نادرˇ جأ فگيفتم","From","I got it from Nader"
252,"جأ","کي جأ بامؤ دأري؟","From Who","Who did you come from?"
253,"جأ","تۊ لیلا جأ بيأ","Instead Of","You come instead of Leila"
254,"جؤر","تي وسيلهٰن کابينتˇ جؤر نهأ","Top","Your stuff are on top of the cabinet"
255,"جابجا","تا أنأ بۊگؤفتيم، جابجا بۊشؤ","So Fast","When we told him/her, he/she left so fast"
256,"جابه","پرتخالانأ ديچين جابه دۊرۊن","Box","Arrange the oranges in the box"
257,"جاجيگا","گيلان تالش ؤ گيلکˇ جاجيگايه","Place","Gilan is Gilak and Talish's place"
258,"جخترأ دأ","هرچي أنأ بۊگؤفته-بۊمأ جخترأ دأ","He/She Forgot","He/She forgot whatever I told him/her"
259,"جرگه","أمي جرگه سي تا آدم-نفر دأره","Group","Our group has thirty members"
