"id","glk_word","glk_example","en_word","en_example"
779,"ورأچۊک","بامؤ أمي ورأچۊک بينيشته","Next To","He/She came and sat next to us"
780,"ورجا","کيتابان أمدˇ ورجا نهأ","With","The books are with Ahmad"
781,"ورف","أجۊر ورف کي تا هسأ بيده بۊ؟","Snow","Who had seen such snow?"
782,"ورگ","ايتأ سيا ورگ بيدئم","Wolf","I saw a black wolf"
783,"وسته","هأنقد مرأ وسته","Is Enough","This much is enough for me"
784,"ول","آتشˇ ولأ فأندر","Fire Flame","Look the fire flame"
785,"ولکي","ايپچه بئسيد ولکي أميرم بأيه","Maybe","Wait a little maybe Amir comes too"
786,"ولگ","مي اينستا ولگأ دأري؟","Page","Do you have my Instagram page?"
787,"ولگ","پئيز ولگان چي خؤشگيلأ بيد","Leaf","In the autumn leaves become so beautiful"
788,"وهاشته","مي پئر مرأ وهاشته بأيم","Allowed","My father allowed me to come"
789,"ويريزانه","أمرأ أمي جا سر ويريزانه","Made Someone Get Up","He/She made me get up from my seat"
790,"ويريزانه","خابˇ جا أمرأ ويريزانه","Woke Someone Up","He/She woke us up"
791,"ويريشتد","گيلکان هأتؤئيد، مشرۊطه زماتم هأ ايوار ويريشتد","They Stood Up","Gilaks are Like this, they suddenly stood up in the constitutional period too"
792,"ويريشته","اۊن کيسه ويريشته؟","stand up","Who is the one standing up?"
793,"ويريشته","بۊشۊ بيدين زأى ويريشته؟","Awake","Go and see if the baby is awake?"
794,"ويشتا","مرأ ويشتايه","Hungry","I'm hungry"
795,"ويشتر","ويشتر آب دۊکۊن","More","Pour more water"
796,"ويني زئک","تي دۊماغ ويني زئکأ پأکۊن","Snot","Wipe away the snot of your nose"
797,"ويگير","گۊشي-يأ ويگير","Pick Up","Pick up the phone"
798,"وٚلٚش","بيأ بيشيم وٚلٚش چيني","Raspberry","Let's go pick raspberry"
799,"يأ","أنأ خأئي يأ اۊنأ؟","Or","Do you want this one or that one?"
800,"ياره","خاليشواشأ فأدن مي مأر ته ره ياره","He/She Muddle","Give the oregano to my mother and she will muddle it for you"
801,"ياور","تأنيد مرأ ياور بديد؟","Help","Can you help me?"
802,"پئر","مي پئر بۊشؤ کارˇ سر","Father","My father went to work"
803,"پئر ؤ مأر","مي پئر ؤ مأر بخانه نئسائيد","Parents","My parents aren't home"
804,"پئرˇ زن","همه-تا پئرˇ زنان کي بد ني-ئيد","Step Mother","Not all step mothers are bad"
805,"پئله","چائي-يأ دۊکۊن پئله دۊرۊن","Saucer","Pour the tea inside the saucer"
806,"پئنج","پئنج تا نان خأيم","Five","I want five breads"
807,"پئنجا","زري-يم خۊ پئنجا ريالأ فأدأ","Fifty","Zary also paid her own fifty Rials"
808,"پا بسر","زاکأ پا بسر کۊدن نوأ","To Pass Over Something","Don't pass over the baby"
809,"پا تۊک","تي پا تۊکˇ سر بئس خانه دۊرۊنأ فأندر","Toe","Stand on the tip of your toes and look inside the house"
810,"پابرانده","پابرانده صارا شؤن نوأ","Barefoot","Don't go in the yard barefoot"
811,"پاخت","دگرأ بۊخۊردم پاختا بؤستم زيمينˇ سر","Fell","I wambled and fell on the ground"
812,"پاستن","کۊجي زاکانأ وا پاستن","Protect","Small children should be protected"
813,"پاماله","أن لۊاسˇ پاماله-يه","Footprint","This is a fox footprint"
814,"پاپى","أمي پاپى بؤبؤسته","Chase","He/She chased us"
815,"پاچ","آدم پاچ ببه أمما آردال نبه","Short","Better be short than be tall and ugly"
816,"پاک","پاک خؤرأ بزه نيشتاوستن","Totally","He/She totally acted like he/she didn't hear us"
817,"پاک","سبزي-يانأ پاکۊدي؟","Clean","Did you clean the vegetables?"
818,"پت","أمي مؤبل ٚ دستهٰ پت بزه","Woodworm","The handle of our sofa has been eaten by woodworm"
819,"پرأ گيفته","زأى تا خۊ مارأ بيده پرأ گيفته","He/She Became Very Happy","The child became very happy as soon as he/she saw his/her mother"
820,"پرأ گيفتيد","چيچيني-يان تا پيچايأ بيده-ئيد پرأ گيفتيد","Flew Away","The sparrows flew away when they saw the cat"
821,"پرکاله","ايتأ پرکاله سئب مرأ فأدن","Piece","Give me a piece of apple"
822,"پرکيم","سرمائي کرأ پرکيم","We're Shaking","We're shaking because of the cold"
823,"پس","وا ويشتر حقˇ سأى بۊکۊنم نيويره پس دکفم","Behind","I should try more otherwise I'll fall behind"
824,"پس بمأنسته","تي پس-بمانسته غذايأ فۊکۊن چيري-يانˇ ره","Remaining (Food)","Throw your remaining foods for the birds"
825,"پس ٚ پۊشت","أشانأ ببر اۊ پس ٚ پۊشت تأود","In The Weeks","Tiger on those weeks"
826,"پسˇ کۊنˇ قاف","مي تۊمانأ ببرده پسˇ کۊنˇ قاف بنأ","Behind the Ghaf Mountain","He/She put pants behind the Ghaf mountain"
827,"پسرزأک","پسرزأکه، أن ٚ تامأ دکفه","Little Boy","he's a little boy, he craves"
828,"پسي","أنˇ پسي تي درزأ فأرس","After","After this study your lessons"
829,"پسي","شامˇ پسي أيم شيمي خانه","After","After the dinner we will come to your house"
830,"پشه دام","تاوستانان أگه پشه-دام نمانه، خۊفتن نشأ","Mosquito Net","if there is no mosquito net in summers, you can't sleep"
831,"پلکان","پلکانˇ سر نيشتن نوأ","Stairs","Do not sit on the stairs"
832,"پيت","أمي سئخان همه پيتأ بؤستد","Nag","All our skewer have been"
833,"پيسخاله","ايتأ پيسخاله نمک دۊکۊن","A Little Bit","Add a little bit of salt"
834,"پيش","علی أمرأ پيش دکفته","Got Past","Ali got past us"
835,"پيش","پيش کيسه؟","The One Starting the Game","Who is the one starting game?"
836,"پيش دٚوٚد","مي پيش دٚوٚد کۊيأ نهأ؟","Apron","Where is my apron?"
837,"پيش گب","کيتاب تۊمانأ بؤسته بمانسته أنˇ پيش گب","Introduction","The book has finished, only the introduction has left"
838,"پيشأشؤ","فردأ أمي مئمانان أئيدي وا بيشيم أشانˇ پيشاشؤ","Favorites","Tomorrow Our guests should go to your sultan"
839,"پيل","مي دس پيل بۊکۊده","Blister","My hand has got blistered"
840,"پيله","ايتأ پيله سئب مرأ فأدن","Big","Give me a big apple"
841,"پيله مأر","ديرۊ تي پيله مأرأ بیدئم","Grandmother","I saw your grandmother yesterday"
842,"پيله پئر","مي پيله پئر بۊشؤ دریا","Grandfather","My grandfather went to the sea"
843,"پيله-سۊس","زأکم أنقد پيله-سۊس؟","Nosy","How nosy is this child?"
844,"پيلکي","هأ پيلکي آدم خۊ گب زئنأ نأنه","Greatness","One with that greatness doesn't know how to talk"
845,"پينيک","تي رختان همه پينيک بزئکه","Patched","All of your clothes has been patched"
846,"پينيک-پاره","پينيک-پاره رختان تازگي داب بؤبؤسته","Patched and Ripped Up","Patched and ripped up clothes are trendy recently"
847,"پيچ واپيچ","أ مؤضۊ پۊر پيچ واپيچه","Complicated","This subject is very complicated"
848,"پيچأ","پيچأ کيشکائان ٚ ره جۊخۊفته دأره","Cat","The cat has ambushed for the chickens"
849,"پيچاک","پيچاک ٚ وينجي-يأ مأنه","Sticky","It's sticky like Saghez"
850,"پٚل","ترأ پٚلأ کۊنمه","In Pieces","I'm gonna cut you in pieces"
851,"پٚلف","تي پٚلفˇ شکمأ آبأ کۊن","Chubby","Burn off your chubby belly"
852,"پۊتار","أيأ چي فۊکۊدي؟ پۊتارأ کۊده","Ant","What did you spill here? the ants gathered"
853,"پۊتۊ","ترأ پۊتۊ دشان","Blanket","Cover yourself with blanket"
854,"پۊر","اۊتۊبۊسانأ آدم دره پۊر","Full","Buses are full of people"
855,"پۊرأ کۊن","تيانأ آب دۊکۊن پۊرأ کۊن","Fill","Fill the stock pot with water"
856,"پۊرد","آهين پۊردأ دٚواريم دئه فأرسيم","Bridge","We will reach after we pass through the iron bridge"
857,"پۊسته ايشکنه-ئي","خؤشحالي جأ پۊسته ايشکنه-ئي","Snapping","He/She is snapping because of happiness"
858,"پۊشت","بۊشۊ فأندر درˇ پۊشت کي ايسأ؟","Behind","Go and see who is behind the door?"
859,"پۊشتابد","تي پۊشتابدأ اۊسان بيشيم","Backpack","Pick up your backpack and let's go"
860,"پۊشتين","گيلک گيلکˇ پۊشتينه","Supporter","Gilak is Gilak's supporter"
861,"پۊل","ايپچه پۊل دأري مرأ فأدي؟","Money","Do you have some money to give me?"
862,"پۊلۊک","مي پرهنˇ پۊلۊک بکفته","Button","My shirt button has fallen off"
863,"چأکۊنم","کرأ خانه چأکۊنم","I Building","I am building a house"
864,"چأکۊنه","بۊشۊ رمضانˇ ويجا، اۊن تأنه تي کارأ چأکۊنه","He/She Fix","Go to Ramezan, he can fix your problem"
865,"چؤ","چؤ دکفتهˈنأ باور کۊدن نوأ","Rumor","Don't believe the rumors"
866,"چؤرنيلي","أ چؤرنيلي پرهنأ ديرۊ بيهئم","Purple","I bought this purple shirt yesterday"
867,"چئل","چئل سال پيش أيأ بامؤبۊم","Forty","I had come here forty years ago"
868,"چا","بۊشۊ چا جأ آب واغۊش","Well","Go bring water from the well"
869,"چار","چار تا کۊئي مرأ فأدن","Four","Give me four pumpkin"
870,"چارپاچه","چارپاچه نيشته بۊ","Cross-legged","He/She was sitting cross-legged"
871,"چارچاک","درأ چارچاک بنأ","Wide Open","He/She left the door wide open"
872,"چالٚکا","چالٚکا ميان دنکفي","Pit","Don't fall inside the pit"
873,"چان","وحيدأ بيدئم ايتأ کيسه بج بچانأ گيفته بۊ","Shoulder","I saw Vahid putting a bag of rice on his shoulder"
874,"چاپ چاپ","بۊلبۊل کرأ چاپ چاپ زنه","Chirping","The Nightingale is chirping"
875,"چاپلا","خؤشالي جأ کرأ چاپلا زنه","Clapping","He/She is clapping because of happiness"
876,"چاک","غذا بۊ هأ چاکأ پۊرأ کۊده","Space Around","The smell of food has filled the space around"
877,"چرت ٚ چۊلا","دئه کرأ چرت ٚ چۊلا گي","Nonsense","You are talking nonsense"
878,"چرخ","ديرۊ ايتأ چرخ بيهئم","Bike","I bought a bike yesterday"
879,"چرخستن","هأچين أمي دؤر چرخستن دريم","Spin","We are spinning around ourselves because of nothing"
880,"چف","أنقد بۊخۊفتي چف بۊکۊدي","Swollen","You slept so much that you are swollen"
881,"چفت","درأ چفتأ کۊدي؟","Close","Did you close the door?"
882,"چفتن","سرمائي چفتن دٚوستيم","Freeze","We froze from the cold"
883,"چمچه","چمچهٰ بيدئي؟","Ladle","Have you seen the ladle?"
884,"چنتا","تۊ چنتا آغۊز دأري؟","How Many","How many walnuts you have?"
885,"چندر","شيمي خانه چندر دۊره","How Far","How far is your home?"
886,"چيسه","أن چيسه؟","What","What is this?"
887,"چيشتن","کرأ غذائانأ ايتأ ايتأ چيشتن درم","Tasting","I'm tasting the foods one by one"
888,"چيچال","تي دسأ چيچالˇ آبˇ مرأ بۊشؤر","Lukewarm","Wash your hands with lukewarm water"
889,"چيچيني","ايمرۊ ايتأ چيچيني-يم نيدئم","Sparrow","I haven't seen any sparrows today"
890,"چٚسک","هرچي بۊگؤفتم تۊنم بيأ، بۊگؤفت چٚسک","No","Whatever I said you come too, he/she said no"
891,"چٚلک","چرک","Dirty","Wash your dirty shirt"
892,"چکˇ پر","سينه-آبأ نأنستي هأچين چکˇ پر زئي","Paddle","He/She didn't know how to swim he/she was paddling aimlessly"
893,"چکستن","ايسپندأ فأندر چۊتؤ چکستن دره","The Jumping Of Peganum harmala While Burning","Look at the Peganum harmala how it jumps"
894,"چۊ","خؤشکˇ چۊ هيمه ره خؤبه","Wood","Dry woods are good for firewoods"
895,"چۊب","چۊب خۊري-يأ","Beaten","You'll get beaten up"
896,"چۊتؤ","أن چۊتؤ کار کۊنه؟","How","How does this work?"
897,"چۊل","تي کفشأ چۊل بۊکۊدي","mud","You made your shoes muddy"
898,"چۊله","ايتأ کيبريت چۊله مرأ فأدن","Match (For Fire)","Give me a match"
899,"چۊم","مي چۊم نيدينه","Eye","My eye doesn't see"
900,"چۊم برا","چۊم برا بؤم أکه أیه","Waited","I was waited for him/her to come"
901,"چۊم دکف","أ خانه چۊم دکف بد ني-يه","View","The view of this house is not bad"
902,"چۊمليز","مرأ چۊمليز بيگيفته","Pinch","He/She pinched me"
903,"کأشکأرأت","ايتأ کأشکأرأت دار ٚ جؤر نیشته","Magpie","A magpie is sitting on the tree"
904,"کؤتر","کؤترانأ سرأدن","Pigeon","Release the pigeons"
905,"کؤر","اۊ کؤرأ فأندر","Girl","Look at that girl"
906,"کؤرأ","کؤرأ بيشيم؟","Which Direction","Which direction do we go?"
907,"کؤل","بنأ خۊ کؤل ٚ سر","Shoulder","He/She put it on his/her shoulder"
908,"کؤل","أ چاقۊ کؤله","Dull","This knife is dull"
909,"کؤيأ","مي شارژر کؤيأ نهأ؟","Where","Where is my charger?"
910,"کؤيأن","اۊشانأ کؤيأن بيدئي؟","Where (places)","Where have you seen them?"
911,"کؤيتأ","کؤيتأ دسکش تي شين ايسه؟","Which One","Which one is your glove?"
912,"کؤيدانه","کؤيدانه-يأ گي؟","Which One","Which one do you say?"
913,"کئخۊدامردي","تي کئخۊدامردي ته ره بدر خۊره","Judgment","Your judgement have only use for yourself"
914,"کئن کئن","کئن کئن دأشتي أکه أئي","Linger","He/She was lingering to see when will you come"
915,"کئواني","مي کۊجي کؤر خؤره ايتأ کئواني-يه","Lady/Housewife","My little daughter is such a lady for herself"
916,"کاباسي","کاباسي بأورديم","Cursed","We've been cursed"
917,"کاس","تي کاس ٚ چۊمأ خۊش دأرم","Blue Eye","I love your blue eyes"
918,"کاسه","ايتأ کاسه پلا مه ره دۊکۊن","Plate","Serve me a plate of rice"
919,"کال","أ به کاله","Unripe","This quince is unripe"
920,"کاکا","ايپچه کاکا چأکۊن بۊخۊريم","A Kind of Pancake","Make some pancakes to eat"
921,"کخ","أ شامپؤ کخ نۊکۊنه","Foam","This shampoo doesn't foam"
922,"کرأ","کرأ شم","Be Going","I'm going"
923,"کردˇکار","تي کردˇ کارأ چأکۊن","Behavior","Change your behavior"
924,"کرچ","پۊر کرچه","Crispy","It's very crispy"
925,"کرک","کرکان کتکتاس کۊنيدي","Hen","Hens go cluck cluck"
926,"کش","اۊن کيسه اۊ کش نيشته؟","Corner","Who is that sitting in the corner?"
927,"کشه","بيأ مي کشه","Embrace","Come to my embrace"
928,"کشک","دۊمرتبه کشکأ بؤستي؟","Spoiled","Are you being spoiled again?"
929,"کفته","تي ميداد زيمينˇ سر کفته","Has Fallen","Your pencil has fallen on the ground"
930,"کل","أ مردأی کله","Bald","This man is bald"
931,"کلانه","بۊشۊ اۊ کلانهٰ بأور","Brazier","Go bring that brazier"
932,"کلاچ","کلاچ پینیرأ اۊساد","Crow","The crow took the cheese"
933,"کلاچ ملاچي","أميرحۊسئن ايتأ کلاچ ملاچي پرهن دۊکۊده بۊ","Black And White","Amir Hossein was wearing a black and white shirt"
934,"کلماجين","أ سئب کلماجينه","Wormy","This apple is wormy"
935,"کله","بۊشۊ کلهٰ وأگيران","Stove","Go turn the stove on"
936,"کي","کي تأنه مي مرأ بأيه؟","Who","Who can come with me?"
937,"کي","من کي بامؤم","That","I came"
938,"کيتاب","أ کيتاب مي شينه","Book","This book is mine"
939,"کيس","مي رختان کيس بۊخۊرده","Wrinkled","My clothes are wrinkled"
940,"کيشؤ","میداد کيشؤ دۊرۊن ننأبۊ","Drawer","The pencil wasn't in the drawer"
941,"کيشکا","کيشکائانأ فۊران","Chicken","Take the chickens away"
942,"کٚتٚل","بۊشۊ ايتأ کٚتٚل مه ره بأور بينيشينم","Small Stool","Go bring me a small stool to sit on"
943,"کٚوار","أمأن کٚوار ٚ أمرأ غذا چأکۊنیم","Chives","We make food with chives"
944,"کٚکٚج","سبزي-يان ٚ دۊرۊن کٚکٚج مرأ ويشتر خۊش أيه","Garden Cress","I love garden cress the most among the vegetables"
945,"کۊ","بیأ بيشيم کۊ","The Mountain","Let's go to the mountain"
946,"کۊجدانه","مي کۊجدانه برارأ بيدئي؟","Little","Have you seen my little brother?"
947,"کۊدن","چي کۊدن دري؟","Do","What are you doing?"
948,"کۊده","هوا سردأ کۊده","Has Become","The weather has become cold"
949,"کۊر ٚ قۊقۊ","کۊر ٚ قۊقۊيأ فأندر","Owl","Look at the owl"
950,"کۊرش","مي غذا همه کۊرشأ بؤ","Burnt","All of my food got burnt"
951,"کۊرش","مي غذا کۊرشأ بؤ","Burnt","My food got burnt"
952,"کۊشتن","پۊتارانأ کۊشتن نوأئيد","Kill","Do not kill the ants"
953,"کۊلک","کاموا کۊلکأ بؤسته","Tangled","The yarn has been tangled"
954,"کۊمۊش","کۊمۊشأ فأندر","Turtle","Look at the turtle"
955,"کۊناکۊنا","کۊچه دوسته بۊ کۊناکۊنا وأگردستيم","Backwards","The alley was closed we had to go backwards"
956,"کۊنه","أ دارأ کۊنه سخته","Root","The root of this tree is strong"
957,"کۊنه مۊنه","کۊنه مۊنه کۊدن نوأ","Doubt","Do not doubt"
958,"کۊنۊس","کۊنۊس خأیي؟","Common Medlar","Do you want common medlar?"
959,"کۊکلا","کۊکلا ديچئن دره","Plot (To Hurt)","He/She is plotting"
960,"گؤرخانه","ايمرۊ گؤرخانه وارش بۊ","Thunder","Today was raining with thunder"
961,"گؤزکا","گؤزکايأ بيده-ئي؟","Frog","Did you see the frog?"
962,"گئسه","خۊ مۊئانأ گئسه کۊنه","Braid (Hair)","He/She braids his/her hair"
963,"گاب","رجب خۊ گابأ فۊرؤختن دره","Cow","Rajab is selling his cow"
964,"گاره","جغلهٰ ببر گاره دۊرۊن بۊخۊسان","Cradle","Put the baby in the cradle to sleep"
965,"گاز","مي گاز مرأ در کۊنه","Tooth","My tooth hurts"
966,"گاز ايشکره","ديشب خۊفته-بي گاز ايشکره کۊدي","To Grate Teeth","You were grating your teeth together when you were sleeping last night"
967,"گاچ","تي پا گاچه مگه؟","Bow-Legged","Are you bow-legged?"
968,"گاگٚلٚف","گاگٚلٚف أرأ دٚوار کۊنم","Sometimes","Sometimes I pass through this way"
969,"گب","أ گب کي گؤفتن درم اۊرارسالانˇ شينه","Word","These words I'm telling you are from years ago"
970,"گب","مي أمرأ گب بزن","Speak","Speak to me"
971,"گب جکشه","بۊزۊر خأستي مي جا گب جکشه","He/She Make Someone To Talk","He/She wanted to make me talk forcefully"
972,"گب خبربر","گب خبربرˇ مرأ گب زئن نوأ","Gossiper","Don't talk to the gossiper"
973,"گب گبˇ سر","گب گبˇ سر بأورده","Interrupting The Subject With Another Subject","He/She interrupted the subject with another subject"
974,"گرا دن","گرا دن بأيه","Slip (Sometheng On The Ground Or Table)","Slip it to me"
975,"گراپئت","أيأ بيأ بينم يه گراپئت","Disfigured","Come here you disfigured guy"
976,"گرد ٚکله","أمي گردˇ کلهˈ لاف دکفته","Gathering","Our gathering got canceled"
977,"گردستن","هرأ گردستن ديبيم","Walk","We were walking around here"
978,"گردن پسه","مي گردن پسه-يأ جۊش بزه","Nape","There's pimple on my nape"
979,"گرديم","هرأ گرديم","We Walk","We are walking around here"
980,"گرزه","گرزه خۊراک آغۊزه","Mouse","The food of the mouse is walnuts"
981,"گرزک","گرزک مرأ بگشته","Bee","The bee stung me"
982,"گرمش","گرمش أمؤن دره","Warm Wind","Warm wind is blowing"
983,"گرگر","زاکانˇ گرگر ونأشته بۊخۊسم","Noise","the noise from the kids didn't let me sleep"
984,"گلاس","درجکأ گلاس بۊم","Staring","I was staring to the window"
985,"گه","خؤره گه","He/She Says","He/She says that from himself/herself"
986,"گيج گيجي","مرأ گيج گيجي دأن نوأ","Tickle","Don't tickle me"
987,"گيرينجي","گيرينجي مۊ مرأ خۊش أيه","Curly Hair","I like curly hair"
988,"گٚزٚر","گزر ٚ آب چۊم ٚ ره خؤبه","Carrot","Carrot juice is good for the eyes"
989,"گٚل","ميرزاکۊچي خان ايتأ پيله گٚل بۊ","Person","Mirza kuchak Khan was a great person"
990,"گٚلٚف","گٚلٚف بينيشينيد","With Distance","Sit with distance"
991,"گۊد","مي مردˇ گۊدان ديرۊ بامؤبيد أمي خانه","Family","Yesterday my husband's family came to our house"
992,"گۊده","خۊ رختانأ گۊده بۊکۊد","Squeezed","He/She squeezed his/her clothes"
993,"گۊزارش","ايمشب وا مي گۊزارشأ تۊمانأ کۊنم","Report","I have to finish my report tonight"
994,"گۊشˇ کۊن","مي گۊشˇ کۊن بۊگؤفته","Beside Someone's Ear","He/She whispered beside my ear"
995,"گۊل","أ گۊلأ ته ره بيهئم","Flower","I bought this flower for you"
996,"گۊلاز","أمي گۊلاز أنˇ کي گيلکيم","Honor","This is our honor that we are Gilak"
997,"گۊلدان","مي گۊلدان بشکفته","Flower Pot","My flower pot broke"
998,"گۊلي","مي گۊلي مرأ در کۊنه","Throat","My throat hurts"
999,"گۊمار","گۊمار ٚ پۊشت جۊخۊفت","Thorn Bushes","He/She hid behind the thorn bushes"
1000,"گۊمگۊمه","مي گۊشˇ کۊن گۊمگۊمه کۊدي","Whisper","He/She whispered beside my ear"
