"id","glk_word","glk_example","en_word","en_example"
519,"شۊمان","شۊمان بيشيد","You (Plural)","You go"
520,"صؤب","من صؤبان زۊد شم کارˇ سر","Morning","I go to work early in the morning"
521,"صبر","صبر بزه","Sneeze","He/She sneezed"
522,"صۊندؤق","صۊندؤق ٚ دۊرۊن بنأم","Coffer","I put it inside the coffer"
523,"عأيدبيني","ايمسال کؤرؤنا وأسي عأيدبيني نأريم","Visiting People in the Eid","This year we don't visit family in the Eid because of Corona"
524,"عأينک","مي عأينکأ بيدئي؟","Glasses","Have you seen my glasses?"
525,"عار ؤ مۊر","أنˇ عار ؤ مۊر بشکفته","Pride","His/Her pride was hurt"
526,"عارنامۊس","أمي مرأ عارنامۊسي دأره","Being Too Formal","He/She is being too formal with us"
527,"عسکي","کي عسکي بزه؟","Sneeze","Who sneezed?"
528,"عم پسرزا","تي عم پسر زأکه؟","Cousin's Son/Daughter","Is he/she your cousin's son/daughter?"
529,"عمجان","ديرۊ بۊشؤم مي عمجانˇ خانه","Aunt (Father's Sister)","I went to my aunt's house yesterday"
530,"عمجان دؤختر","فردأ مي عمجان دؤختر ٚ خانه ايسائيم","Cousin (Father's Sister's Daughter)","We are at my cousin's house tomorrow"
531,"عمجان پسر","مي عمجان پسر رشت ايسأ","Cousin (Father's Sister's Son)","My cousin is in Rasht"
532,"عنقص","أنˇ کاران عنقص ني-يه","On Purpose","His acts are not on purpose"
533,"عوض","أن همه پۊل فأدأئي اۊنˇ عوض چي فأگيفتي؟","In Return","You spent a lot of money, what did you get in return?"
534,"عوض دکش","أمي پرهنانأ عوض دکش بۊکۊديم","Exchange","We exchanged our shirts"
535,"عيلاج","حسودي-يأ هيچ عيلاج ني-يه","Cure","There's no Cure for jealousy"
536,"عيلاوه","ايتأ دئه عيلاوهˈ کۊن","Add","Add another one"
537,"غۊرصه","غۊرصه خۊردن نوأ","Sad","Don't be sad"
538,"فأدأ","ترأ چي فأدأ؟","Gave","What did he/she gave to you?"
539,"فأده","تي نظر أمي پۊلأ فأده؟","He/She Gives","Do you think he/she gives us our money?"
540,"فأرسه","شانس بأوردم ماسۊ مرأ فأرسه","He/She Helped","I was lucky that Masoo helped me"
541,"فأمستن","أ مؤضۊ فأمستن أنقد سخته؟","Understand","Is this so hard to understand?"
542,"فأندر","مرأ فأندر","Look","look at me"
543,"فأکش","أ لافندأ فأکش","Pull","Pull this rope"
544,"فأکش","دئه مي کله فأکش نأره","Focus","My brain can't focus anymore"
545,"فأکش","من گم وا بدن هأى فأکش دأن دره","Continue","I'm telling him/her to stop but he/she continues"
546,"فؤقا","آهينأ  فؤقا گيلˇ دۊرۊن","Dip","Dip the iron in the mud"
547,"فئلم","أ فئلمأ بيدئي؟","Movie","Have you seen this movie?"
548,"فادار","بۊشۊ تي زاکأ فادار","To Hold Your Baby Over The Toilet","Go and hold your baby over the toilet"
549,"فارسانه","بؤشؤ مأمدأ فارسانه","Give Someone a Ride","He went to give Mohamad a ride"
550,"فاش","فاش دأن دره","Curse","He is cursing"
551,"فال","أ پرهن ته ره فاله","Loose","This shirt is loose for you"
552,"فاکشيم","بيأ أ ميزأ فأکشيم ببريم اۊرأ","Pull","Let's pull this table over there"
553,"فترات","أشان دئه فترات کاشتن دريد","Injustice","They are doing injustice"
554,"فته کۊدن","دئه أمرأ فته کۊدن دره","annoy","He/She is annoying us"
555,"فجه","أيأ چي فجه؟","Spilled","What's spilled here?"
556,"فرخ","أن اۊنˇ مرأ فرخ کۊنه","Different","This is different from that"
557,"فسفاله","چائي فسفالهˈ فيشان","Residue","Throw away the tea residue"
558,"فسک","مي فسکأ بۊرۊز ندي","Secret","Don't reveal my secret"
559,"ففه","ففه خۊري؟","White Liver (Food)","Would you eat white liver?"
560,"فلنگي","چي ره فلنگي؟","Limping","Why are you limping?"
561,"فلگان","سٚفره ٰ فلگان","Shake","Shake the tablecloth"
562,"فيت","أمرأ فيت دأن دره","Provoke","He/She is provoking us"
563,"فيريني","فيريني خۊري؟","Porridge","Would you eat porridge?"
564,"فيشادن","أشان فيشادني-ئيد","Throwing Away","These are thrown away"
565,"فيللي","فيللي تاودن خيابانˇ دۊرۊن خؤرم کار ني-يه","Spit","Spitting in the street is not a good thing"
566,"فيللي","فيللي تاودأ","Spit","He/She spat"
567,"فينگي","چي ره فينگي-يانˇ مأنستن گب زني؟","Snuffle","Why are you snuffling?"
568,"فيچال","فيچال أنˇ آبأ بيگير","Wring","Wring it and take its water"
569,"فچم","أمأن بجار ٚ مئن فچم کار کۊنيم","Bend","We bend over to work in the rice field"
570,"فک","فک بأورده","Misfortune","He/She is misfortunate"
571,"فگيفتم","ايمرۊ حۊقۊق فگيفتم","I Got","I got salary today"
572,"فۊ","فۊ بزن سردأ به بزين بۊخۊر","Blow","Blow it until it's cool and then eat"
573,"فۊبرده","تا کيکأ بأورديم فۊبرده","Swallowed","He/She swallowed the cake as soon as we bring it"
574,"فۊتۊرکسته","شال أمي کرکانأ فۊتۊرکسته","Attacked","Jackal attacked our chickens"
575,"فۊداشتن","کي بۊ فۊداشته؟","Shoot","Who was the one shooting?"
576,"فۊرانه","أنˇ کاران همهˈ فۊرانه","Keeps Away","His/Her behavior keeps everyone away"
577,"فۊندؤق","چنتا فۊندؤق دأري؟","Hazelnut","How many hazelnuts do you have?"
578,"فۊچين","تي چۊمانأ فۊچين بۊخۊس","Close Your Eyes","Close your eyes and sleep"
579,"فۊکۊده","شيرأ فۊکۊده فرشˇ سر","Spill","He/She spilled the milk on the carpet"
580,"فۊکۊن فيشان","أيأ هميشک فۊکۊن فيشانه","Messy","It's always messy here"
581,"فۊگۊردسته","فۊگۊردسته خۊفته","Sleeping On the  Stomach","He/She is sleeping on the stomach"
582,"فۊگۊردسته","أمي خانه ديفار فۊگۊردسته","Knocked Down","The wall of our house was knocked down"
583,"قؤوت","أنˇ دسأ قؤوت دينه","Strength","His hand has no strength"
584,"قاتؤق","ايپچه قاتؤق دۊکۊن کاسه مئن","Stew","Serve some stew in the bowl"
585,"قار","مي مرأ قاره","Angry","He/She is angry with me"
586,"قاق","خبرأ کي بيشتاوستيم قاقأ بؤستيم","Wandering","I was wandering when I heard the news"
587,"قاينا","بيلاخره بتأنستم اۊنأ قاينا بۊکۊنم","Convinced","I could finally convinced him/her"
588,"قيش","مي قيشأ بيدئي؟","Belt","Have you not seen my belt?"
589,"قٚزٚنج","ايپچه پۊل قٚزٚنج بۊکۊدم","Saved (Money)","I saved some money"
590,"قۊشمه مۊ","بۊشۊ تي قۊشمه مۊيأ چأکۊن","Disheveled Hair","Go fix your disheveled hair"
591,"لؤجنک","بۊشۊ لؤجنکأ دود پيچأ نأيه بۊدۊرۊن","Dormer","Go and close the dormer so cat won't come inside"
592,"لؤفٚت","تي پا سر بئس هي کسˇ لؤفٚتأ کشئن نوأ","Stoop to a Favor","Stand on your feet and don't stoop to a favor"
593,"لا","أ کاغذأ بنه تي دفترˇ لا","Between Two Things","Put this paper between your notebook"
594,"لا","هرچي زأمت بکشه-بيمأ لا بۊکۊد","Ruined","He/She ruined all of our hard work"
595,"لابدان","لابدانأ‌ بيگير","Spider","Catch the spider"
596,"لار","أ تۊرف لاره","Hollow","This radish is hollow inside"
597,"لافند","لافندأ کؤيأ بنأئي؟","Rope","Where did you put the rope?"
598,"لانتي","أ لانتيأ بيدين","Snake","Look at this snake"
599,"لانتۊز","چي ره لانتۊز تأوده؟","Kick","Why is he/she kicking?"
600,"لته","اۊ لتهٰ مرأ فأدن ميزأ پأکۊنم","Handkerchief","Give me the handkerchief to clean the table"
601,"لس","غذا خۊردنˇ پسي آدم لسأ به","Flimsy","One become flimsy after eating"
602,"لپه","لپهٰ تأود","Ball","Throw the ball"
603,"لچه","چیچینی دارˇ لچه نیشته","Top (Of Something)","Sparrow is sitting on the top of the tree"
604,"لۊاس","لۊاس دامان ٚ مئن زيويسته","Fox","The fox lives in the jungle"
605,"لۊچ","لۊچي مگه؟","Cross-Eyed","Are you cross-eyed?"
606,"لۊچان","أمرأ لۊچان زنه","Rolling Eyes","He/She rolling his/her eyes at us"
607,"مأر","مي مأر بۊشؤ کار ٚ سر","Mother","My mother has gone to work"
608,"مأرˇ مرد","بعضي-تأ زأکان مأرˇ مرد دأريدي","Stepfather","Some kids have a stepfather"
609,"مأنستن","خۊ پئرˇ مأنستن گب زنه","Like","He/She speaks like his father"
610,"مئخ","بچمسته مئخانأ فيشان","Nail","Throw away crooked nails"
611,"مئوه","مئوهٰنأ بۊشؤستي؟","Fruit","Did you wash the fruits?"
612,"ما","ايتأ ما بدن","Kiss","Give me a kiss"
613,"ما","أ ما وا بشم مۊسافرت","Month","I should go on a trip this month"
614,"مائي","أکبر دۊتا سيفيد مائي بيهه-بۊ","Fish","Akbar had bought two Caspian white fish"
615,"مات","چي ره ماتأ زئي؟","Astonished","Why are you astonished?"
616,"ماتؤر","مي ماتؤر رؤشنأ نيبه","Motorcycle","My motorcycle doesn't start"
617,"ماده","مي ماده مرأ در کۊنه","Stomach","My stomach hurts"
618,"ماز","اۊ مازأ مرأ وأسينم مي کفشأ","Wax","Give me that wax to applying it to my shoes"
619,"ماسکأ","ماسکأ بازي-يأ تۊمانأ کۊن","Ridiculous","Stop being Ridiculous"
620,"ماشل","مي مأرˇ مرأ شؤن دريم مي ماشلˇ خانه","Aunt (Mother's sister)","I'm going to my aunt's house with my mother"
621,"ماشه","اۊ ماشه-يأ مرأ فأدن","Metal Pincers","Give me that metal pincers"
622,"ماشک","ماشکأ تأود","Fishing Net","Throw the fishing net"
623,"ماقؤل","ماقؤل بۊگؤفتم","It's Good That","It's good that I said that"
624,"مالا","مي پئر مالايه","Fisherman","My father is a fisherman"
625,"ماندگي","بدأ ايپچه ماندگي بيگيرم","Getting Rest","Let me get some rest"
626,"ماچي","ايتأ ماچي مرأ ديهي؟","Kiss","Would you give me a kiss?"
627,"مترس","باقلا باغ ٚ مترسه","Scarecrow","He's the scarecrow of the bean garden"
628,"مته","مته نهأن نوأ","Nuisance","do not make a nuisance"
629,"مجاز","مي مجاز نبره","Taste","It's not my taste"
630,"مدار","هأ مدار بۊشۊ جۊلؤ","Method","Go forward with this method"
631,"مرأ","مرأ بۊگۊ چي خأئي؟","Me","Tell me what you want?"
632,"مراغ","آدمأ مراغأ گيره","Creep","Adam is a problem"
633,"مرجانه","أ کارتانأ مرجانه فگيفتم","Free","I got these cards for free"
634,"مرد ٚ خاخۊرزا","مي مرد ٚ خاخۊرزا أمي خانه ايسأ","Husband's Nephew/Niece","My husband's niece is in our house"
635,"مردˇ برار","مي مردˇ برارˇ خانه هأ کۊچه دۊرۊنه","Husband's Brother","My husband's brother's house is in this alley"
636,"مردˇ برار زن","تي مردˇ برار زنأ بيدئم","Sister in Law (Husband's Brother's Wife)","I saw your sister in law"
637,"مردˇ خاخۊر","مي مردˇ خاخۊر بۊشؤ خارج","Sister in Law (Husband's Sister)","My sister in law went abroad"
638,"مردأى","أ مردأى ديرۊز بامؤ","Man","This man came yesterday"
639,"مردۊم","مردۊم همه بامؤبيد","People","All people had come"
640,"مرگٚنا","مرگٚنا بزن","Putting Head Down","Put your head down"
641,"مضرت","أنقد کي مضرتي تي جان همه جيجايه","Mischievous","You're so mischievous that all of your body is wounded"
642,"من","من بۊشؤم","I","I went"
643,"مه ره","أ کفشأ مه ره بيهئم","For Myself","I bought these shoes for myself"
644,"مي","مي مأر أمؤن دره","My","My mother is comeing"
645,"ميان","أ گب أمي ميان بمانه","Between","Keep these words between us"
646,"مچد","مچد شؤن دري؟","Mosque","Are you going to the mosque?"
647,"مچه","أمين خۊ مچهٰ عمل بۊکۊده","Chin","Amin got a chin surgery"
648,"مک","مي سرأ مکأ کۊده","Dandruff","I got dandruff"
649,"مۊران","آهين مۊران بزه","Rust","The iron is rusty"
650,"مۊرجه","ايپچه مۊرجه دۊکۊن","Lentil","Add some lentil"
651,"مۊرجه","ايپچه مۊرجه دۊکۊن","Lentil","Add some lentil"
652,"مۊرغانه","دۊتا مۊرغانه بأور مۊرغانه دشکن بۊخۊريم","Egg","Bring two eggs to eat fried eggs"
653,"مۊس","مۊس بۊکۊده","Mold","It got moldy"
654,"مۊسافرت","أئي بيشيم مۊسافرت؟","Trip","Do you wanna go on a trip together?"
655,"نأرم","تي شۊمارهˈ نأرم","I Do Not Have","I do not have your number"
656,"نأنسته-بؤ","نأنسته-بؤ أ کارأ بۊکۊده","Unknowingly","He/She did this unknowingly"
657,"نؤبدان","اينفرأ بأور نؤبدانأ چأکۊنه","Gutters","Bring someone to fix the gutters"
658,"نؤرۊزبل","جلالي تقویم ٚ مئن ۱۷ مۊرداد نؤرۊزبله","Nowruzbal","In Jalali calendar Mordad 17 is Nowruzbal"
659,"نابراري","أن مي نابراري-يه","Step Brother","This is my step brother"
660,"ناجه","ناجه دأرم ايمرۊ بازي-يأ سر بيبيم","Hope","I hope to win the game today"
661,"ناحق ؤ نابۊد","ناحق ؤ نابۊد کرأ زٚجٚر کشیم","Unjustly","We are suffering unjustly"
662,"ناخبر","رضا ناخبر بامؤ أمي خانه","Intrude","Reza intrude to our house"
663,"ناخۊش آوال","ايمرۊ ايپچه ناخۊش آوالم","Sick","I'm a little bit sick today"
664,"ناخۊن","مي پا ناخۊن بشکفته","Nail","My toe nail broke"
665,"ناخۊن","تي ناخۊنأ بيگير","Nail","Clip your nail"
666,"ناره","ناره کۊدن دره","Nazy","It is silent"
667,"نازبداشته","أمي زأکأن نازبداشته-ئيد","Spoiled","Our kids are spoiled"
668,"ناسۊس","بۊشۊ ناسۊسأ بأور","Air Pump","Go bring the air pump"
669,"ناقلن","ناقلن تۊ أمي مرأ بيأ","At Least","At least you come with us"
670,"ناکس","ناکسˇ پۊشتين بؤستن نوأ","Coward","Do not support the coward"
671,"نتاج","أمان گيلک ٚ نتاجيم","Generation","We are gilak generation"
672,"نجاق","نخأستي بأيه نجاقˇ مرأ أنأ بأوردم","Force","HE/She didn't want to come we forced him/her"
673,"ندار","ندارˇ آدمه","Broke","He/She is broke"
674,"نشأ","جاده-يأ آب بيگيفته شؤن نشأ","Can't","The water closed the road we can't go"
675,"نقل","ايتأ نقل بۊگۊ","Story","Tell a story"
676,"نم","أمي وسيلهˈنأ نم بزه","Moist","Our stuff got moisten"
677,"ننأ","فاکتؤران ميزˇ سر ننأ","Is Not","Invoices are not on the table"
678,"نهأن","پلايأ نهأن درم گازˇ سر","Put","I'm putting the rice on the stove"
679,"نوأ","اۊتؤ گب زئن نوأ","Don't","Don't talk like that"
680,"نيده بيده","نيده بيده-کانأ مأنه","Upstart","He/She looks like an upstart"
681,"نيشتاو","زأکي-يم نيشتاو بي","Stubborn","You were stubborn in your childhood too"
682,"نيميزگيره","درأ نيميزگيره وأکۊن","Slightly","Open the door slightly"
683,"نيويره","مرأ سربسر نهأن نوأ نيويره بد ديني-يأ","Otherwise","Don't bother me otherwise you'll see badly"
684,"نيويشتن","کيتاب نيويشتن درم","Write","I'm writing a book"
685,"نپج","أ نۊخۊدان نپجه","Take Too Long To Cook","These peas take too long to cook"
686,"هأتؤ","حؤکمن هأتؤيه کي شۊمان گيد","As Well","It's most likely as well as you say"
687,"هأنه","أمي دار ؤ ندار هأنه","This Is","This is all of our property"
688,"هأچين","هأچين پلا خۊردن دريم","Plain","We're eating plain rice"
689,"هأچين پلا","هأچين پلا خۊردأن درم","Plain Rice","We're eating plain rice"
690,"هأچينه","خانه أثاثانأ هأچينه فأدأ بۊشؤ","Free","He/She gave away the house furniture for free"
691,"هئن","چي هئن دري؟","Buying","What are you buying?"
692,"هر ساعت دقه","هر ساعت دقه أيه أمي خانه","Every Minute","He/She comes to our house every minute"
693,"هرتا","هرتا گۊشي-يان ايتأ خؤبي دأريدي","Each","Each mobile phone has its own features"
694,"هسأ","هسأ أيم","Now","I'm coming now"
695,"هش","هش نفر بامؤئيد","Eight","Eight people came"
696,"هف","هف نفر نامؤبيد","Seven","Seven people had not came"
697,"هف شب","فردأ مي جغله هف شبه","The Seventh Night's Party For Baby","Tomorrow is the seventh night's party for my baby"
698,"هلاچين","زاک ٚ ره صارا دۊرۊن هلاچين چأکۊدم","Swing","I made a swing for my child in the yard"
699,"هلماله","دئه هلماله اۊنˇ ورجا نشم","Never","I will never go to him/her"
700,"هم زاما","مي هم زاما هرشب أمي خانه ايسأ","Brother in Law (Wife's Sister's Husband)","My brother in law is at our house every night"
701,"همه-دأنه","فردأ همه-دأنه أئيدي","All Of Them","All of them will come tomorrow"
702,"هميشک","گيلان هميشک وارشي-يه","Always","Gilan is always rainy"
703,"هندم هۊندم","هندم هۊندمه کي واران بأيه","Soon","it will rain soon"
704,"هني","هني وا بيشي","Still","You still have to go"
705,"هيزار","هيزار ريال دئه پۊل ني-يه","Thousand","One thousand Rials is not that much money anymore"
706,"هيست","واران وارستي هيستأ بؤستم","Wet","It was raining and I got wet"
707,"هيل","ايپچه هيلم دۊکۊن","Coriander","Add some coriander too"
708,"وأبرازه","أ پرهن ترأ وابرازه","It Suits","This shirt suits you"
709,"وأجه","تي دۊماغأ اي چي وأجه","Sticking","Something's sticking on your nose"
710,"وأده","أمرأ وأده بيگيفته","Invite","He/She has invited us"
711,"وأسي","وأسي دۊ تا نان فگيفته-بيم","Should","I should have bought two breads"
712,"وأسي","ايمرۊ پۊر کار دأرم، هأنˇ وأسي زۊد بأمؤم","Because","There's a lot of work, I came early because of that"
713,"وأمجي","چي ره وأمجي؟","You Are Looking For","What are you looking for?"
714,"وأمرازه","أ گبان ترأ وأمرازه","It Doesn't Suit","These words doesn't suit you"
715,"وأورس","اۊ زناکأ وأورس","Ask","Ask that woman"
716,"وأورسي","هرچي وأورسي ترأ گب بسرأ کۊنه","You Ask","Whatever you ask he/she changes the subject"
717,"وأچئن","خۊ خانه سرأ وأچئن دره","Destroying","He/She is destroying the roof of his/her house"
718,"وأچۊک","دارأ وأچۊک","Climb","Climb the tree"
719,"وأکفتم","دئه وأکفتم","I'm Being Exhusted","I'm Exhusted"
720,"وأکفته","أمرأ وأکفته","Pester","He/She pestered us"
721,"وأکۊده","مأمدأ وأکۊده بامؤ","Drop","He/She Dropped Mohammad off and he/she came back"
722,"وأکۊن","درأ وأکۊن","Open","Open the door"
723,"وأگردان","أ کيتابأ تۊ وأگردان بۊکۊدي؟","Translate","Did you translate this book?"
724,"وأگردان","اۊ شامي-یأ وأگردان","Flip","Flip that cutlet"
725,"وأگردانئده","أ خيابانˇ ايسمأ وأگردانئده","They Have Changed","They have changed the name of this street"
726,"وأگردانئم","کيتابأ وأگردانئم","I Returned","I returned the book"
727,"وأگيران","گازأ وأگيران","Turn Something On","Turn the Stove on"
728,"وئر","تأني أ رۊخانأ وئر بزني؟","Crossing The River","Can you cross the width of this river?"
729,"وا","أيتأ اۊيتأ نأره همه وا بأئيد","Must","There's no this and that, everyone must come"
730,"وا","سردˇ وا دمه","Wind","Cold wind is blowing"
731,"وا","هرچي خۊرم هنده مرأ وا","Craving","Whatever i eat I'm still craving"
732,"وابؤن","در وابؤ","Opened","The door opened"
733,"واترکانم","ترأ بيدينم واترکانم","I Rip Apart","If I see you I'm gonna rip you apart"
734,"واترکستم","خأنده جأ واترکستم","I Burst Out","I burst out laughing"
735,"واتين","گيدي کؤرؤنا واتين دأره","Communicable","They say Corona is communicable"
736,"واجؤر","أ بج واجؤر کۊنه","Fluffy","This rice is fluffy"
737,"واجام","زرد ٚ واجامأ مأنه","Eggplant","It looks like a yellow eggplant"
738,"واجاوره","أمرأ خۊره واجاوره","He/She Vomits","He/She eats us and vomits agine"
739,"واخان","أنأ واخان","Re-Read","Re-read this"
740,"واخب","أمان ديرۊ واخبأ بؤستيم","Informed","We got informed yesterday"
741,"واخۊر","آب واخۊر","Drink","Drink water"
742,"واد","فچم تي وادأ بيگيرم","Measure","Bend and let me measure you"
743,"واداشته","أمرأ واداشته أ سردˇ هوا دۊرۊن بئسيم","Forced","He/She forced us to stay in this cold weather"
744,"وارؤختن","گيلانأ وارؤختن درد","Plunder","They are plundering Gilan"
745,"واران","ديرۊ واران بامؤ","Rain","It rained yesterday"
746,"وارستن","واران وارستن دره","Raining","It is raining"
747,"وارسي","ايپچه اۊشنتر همهٰ وارسي کۊديد","Inspection","A little further they were inspecting everyone"
748,"وارسي","وا أول وارسي بۊکۊنيد","Research","We should research first"
749,"واز","چيچيني-يانأ فأندر چۊتؤ واز کۊنیدي","Flying","Look the sparrows how they are flying"
750,"واز ؤ ولنگ","زاکان پارکˇ دۊرۊن چي واز ؤ ولنگي کۊنيدي","Capering","Children capering in the park"
751,"وازده","مرأ وازده بأورده","Hassle","He/She hassling me"
752,"وازن","تي کفشأ وازن بيشيم","Wear","Wear your shoes let's go"
753,"واسئن","اۊن چیسه ترأ وأسئن دري؟","Rub","What are you rubbing to yourself?"
754,"واسرأ دأن","أمرأ واسرأ دأ","Send Someone on a Fool's Errand","He/She Sent us on a fool's errand"
755,"واسۊجانه","أمي خۊنا واسۊجانه تا خۊ مدرکأ فأگيفت","He/She Burned Up","He/She burned all of our blood up until he/she graduated"
756,"واسۊخسته","ترأ واسۊخسته آدم هفتاد سال پاکي نأره","Ran Into","Someone who ran into you won't be cleansed for seventy years"
757,"واش","گابˇ ره خاش فۊکۊنه سکˇ ره واش","Grass","He/She throws bone for the cow and grass for the dog"
758,"واشان","بۊشۊ جايأ واشان","Spread","Go and spread the bed sheets"
759,"واشکاف","أ پرهن ٚ درزأ واشکاف","Open","Open the seam of this shirt"
760,"واشکاف","مرأ حالي نؤبؤسته، ايپچه واشکاف","Explain More","I didn't understand, explain a little bit more"
761,"واشکافيدي","باهارˇ وخت گۊلان واشکافيدي","Bloom","In the spring the flowers bloom"
762,"والان","تي پرهنأ اۊيأ والان","Hang","Hang your shirt over there"
763,"والنگ","نيصفˇ را والنگأ دأ","Quit","He/She quit halfway through"
764,"واليشتن","گاب خۊ ماندهٰ واليشتن دره","Licking","Cow is licking its calf"
765,"وامختن","چي-يأ وأمختن دري؟","Search","What are you searching for?"
766,"وامختن دري","چي-يأ وأمختن دري؟","You Searching","What are you searching for?"
767,"واهيل","مي ديل واهيلأ بؤسته","Impatient","My heart has been impatient"
768,"واويجان","مائي-يأ خؤب واويجان","Grill","Grill the fish properly"
769,"واوين","أ خالأ واوين","Cut","Cut this branch"
770,"واپس","چي ره واپس شؤن دري؟","Backward","Why are you going backward?"
771,"واپلکه","تيانأ بنه بدأ ايپچه واپلکه","Soaked","Leave the stock pot to get soaked"
772,"واچرد","تا نانأ بيده نيصفأ وأچرد","Cut Something Into Pieces","As soon as he/she saw the bread he/she cut it into half"
773,"واکاريد","بعضي-يان خأئيد أمي ميانأ واکاريد","To Make Quarrel Between Two People","Some people want to make a quarrel between us"
774,"واکاشته","أمرأ أيأ واکاشته","Made Us Wait","He/She made us wait here"
775,"واکاشته","أمرأ أيأ واکاشته","Made Us Wait","He/She made us wait here"
776,"واگير","أن ٚ مأر أنˇ گبأ واگير کۊنه","Confirming Someone's Words","His/Her mother Confirms his/her Words"
777,"وخت","باهارˇ وخت أيم گيلان","Season","I'll come to Gilan in the spring season"
778,"ودره","اۊ ودرهˈ فأدن مرأ","Bucket","Give me that bucket"
